{
  "article": {
    "title": "McSweeney",
    "text": "McSweeney is a surname. Notable people with the surname include:\n\nAilis McSweeney (born 1983), Irish sprinter specialising in the 100 metre event\nAlex McSweeney, British actor who appeared on the TV show EastEnders (2003–2004)\nAlf McSweeney, printer who founded the magazine Race Walking Record in 1941, and edited the magazine for 16 years\nBarry McSweeney, Irish scientist and the first Chief Science Advisor to the Government of Ireland\nDave McSweeney (born 1981), English footballer, senior career began in 2000\nDavid McSweeney (politician) (born 1965), Investment banker who was the Republican candidate in Illinois's 8th congressional district election, 2006\nElla McSweeney (born 1978), Irish radio and television presenter and producer\nErvin McSweeney (born 1957), New Zealand cricketer who played 16 One Day Internationals in the 1980s\nJames McSweeney (born 1980), English mixed martial arts fighter and former Muay Thai kickboxer\nJohn McSweeney, known as John Zewizz (born 1955), English-born American industrial music performer\nJohn McSweeney (Ohio politician) (1890–1969), United States congressman representing Ohio\nJoyelle McSweeney (born 1976), poet, critic, and professor at the University of Notre Dame\nLeah McSweeney (born 1982), founder and CEO of the \"Married to the MOB\" clothing line\nLeon McSweeney (born 1983), Irish footballer, senior career began in 2000\nMiles Benjamin McSweeney (1855–1909), 87th Governor of South Carolina (1899–1903)\nMorgan McSweeney (born 1977), British campaign manager\nNeil McSweeney (born 1976) Songwriter and musician based in Sheffield, England\nPeter McSweeney (1842–1921), merchant and politician who represented the Northumberland division in Canadian Senate (1899–1921)\nRobyn McSweeney (born 1957), Australian politician, member of the Legislative Council in the state of Western Australia\nTrash McSweeney, Australian musician and lead singer for the band The Red Paintings\n\n\n== See also ==\nMcSween (surname)\nMcSweeney's, an American publishing house\nTimothy McSweeney's Quarterly Concern, a literary journal published by the McSweeney's publishing house\nNaoíse Mac Sweeney, British archaeologist, historian, writer, and academic."
  },
  "quiz": "{\n\"quiz\": [\n    {\n    \"question\": \"Who is the Irish sprinter specialising in the 100 metre event?\",\n    \"options\": [\n        {\"A\": \"Ailis McSweeney\"},\n        {\"B\": \"Alex McSweeney\"},\n        {\"C\": \"Alf McSweeney\"},\n        {\"D\": \"Barry McSweeney\"}\n    ],\n    \"answer\": \"A\"\n    },\n    {\n    \"question\": \"Who was the first Chief Science Advisor to the Government of Ireland?\",\n    \"options\": [\n        {\"A\": \"Dave McSweeney\"},\n        {\"B\": \"Barry McSweeney\"},\n        {\"C\": \"David McSweeney\"},\n        {\"D\": \"Ella McSweeney\"}\n    ],\n    \"answer\": \"B\"\n    },\n    {\n    \"question\": \"Who is the founder and CEO of the 'Married to the MOB' clothing line?\",\n    \"options\": [\n        {\"A\": \"Leah McSweeney\"},\n        {\"B\": \"Leon McSweeney\"},\n        {\"C\": \"Miles Benjamin McSweeney\"},\n        {\"D\": \"Morgan McSweeney\"}\n    ],\n    \"answer\": \"A\"\n    },\n    {\n    \"question\": \"Who is the Australian musician and lead singer for the band The Red Paintings?\",\n    \"options\": [\n        {\"A\": \"Robyn McSweeney\"},\n        {\"B\": \"Trash McSweeney\"},\n        {\"C\": \"Neil McSweeney\"},\n        {\"D\": \"Peter McSweeney\"}\n    ],\n    \"answer\": \"B\"\n    },\n    {\n    \"question\": \"Who is the British archaeologist, historian, writer, and academic?\",\n    \"options\": [\n        {\"A\": \"Timothy McSweeney\"},\n        {\"B\": \"Naoíse Mac Sweeney\"},\n        {\"C\": \"James McSweeney\"},\n        {\"D\": \"John McSweeney\"}\n    ],\n    \"answer\": \"B\"\n    }\n]\n}"
}